,Text ID,Title,Negative,Neutral,Positive,Geopolitical Entities
3127,142,America’s white fragility complex: Why white people get so defensive about their privilege,0.0,0.734,0.266,America
3131,483,U.S. added 257K jobs in January; unemployment ticks up to 5.7 percent,0.209,0.791,0.0,US
3142,1257,"Republicans barnstorm Iowa after debate, as underdogs show new life",0.0,1.0,0.0,Iowa
3143,2279,Court Could Force Same-Sex Marriage on Every State - US - CBN News - Christian News 24-7 - CBN.com,0.0,1.0,0.0,US
3145,3839,White House brings lawmakers into Situation Room on Iran,0.0,1.0,0.0,Iran
3146,4227,A close Wisconsin primary could spell future trouble for Clinton,0.231,0.769,0.0,Wisconsin
3153,2776,Treasury will begin issuing Iran sanctions waivers under Obama order,0.0,0.833,0.167,Iran
3154,340,2016 Race Collides With Baltimore Unrest,0.296,0.704,0.0,Baltimore
3155,359,"DoD teams surveying US military sites for potential Gitmo transfers, lawmakers vow fight",0.178,0.822,0.0,US
3160,4515,"ISIS claims responsibility for Garland, Texas, shooting",0.0,1.0,0.0,Garland; Texas
3162,3717,Police Arrest Suspect In Charleston Church Shooting,0.479,0.521,0.0,Charleston
3164,1303,Why Ted Cruz Has the Most to Lose in New Hampshire,0.229,0.771,0.0,New Hampshire
3166,2316,Alabama Lawmaker: Same-Sex Couples Don’t Deserve Same Financial Benefits As Other Families,0.0,0.809,0.191,Alabama
3169,4021,"In Ethiopia, Obama seeks progress on peace, security in East Africa",0.0,0.479,0.521,Ethiopia
